{
  "contract": "workspace.binding",
  "version": 1,
  "repository_id_sha256": "aaaaaaaaaaaaaaaaaaaaaaaaaaaaaaaaaaaaaaaaaaaaaaaaaaaaaaaaaaaaaaaa",
  "workspace_id_sha256": "bbbbbbbbbbbbbbbbbbbbbbbbbbbbbbbbbbbbbbbbbbbbbbbbbbbbbbbbbbbbbbbb",
  "change_id": "CHG-2026-0002",
  "bound_at": "2026-08-31T00:00:00+00:00",
  "state": "ACTIVE"
}
